{
  "actor_type": "human_user",
  "capability_decision": "allow",
  "correlation_id": "corr_df9539010d43",
  "created_at": "2026-06-04T08:51:53.289918+00:00",
  "handoff_id": "handoff_v7_3_5ca056d24cf2",
  "human_authorization_ref": "human_auth_v7_3_1ba43f1173c7",
  "operation": "workflow.instance.start",
  "policy_decision": "allow",
  "risk_flags": [
    "local_folder_read",
    "provider_invocation",
    "user_confirmed"
  ],
  "source": "mission_tui",
  "target_refs": {
    "authorized_folder_ref": "pending_authorization_resolution",
    "requested_path_ref": "path_ref:tests/fixtures/desktop/技术分享",
    "workflow_instance_target_ref": "workflow_instance_target_v7_3_2b9572188324"
  },
  "user_confirmed": true,
  "workflow_diff_id": "workflow_diff_v7_3_a931eff4dd7c",
  "workflow_spec_id": "workflow_spec_v7_3_874f855b75a8"
}